{
  "id": "evt-demo-001",
  "actor_id": "demo-user",
  "type": "lie",
  "context": {
    "domain": "info-integrity",
    "note": "Detected false claim in memo."
  },
  "evidence": [
    "memo-123.pdf",
    "fact-source-A",
    "fact-source-B"
  ],
  "inner_signals": [
    "certainty-spike",
    "offense-reactivity"
  ],
  "evidence_strength": 0.42,
  "ambiguity_level": "high",
  "reversibility": "low",
  "fatigue_load": 0.65,
  "timestamp": "2025-09-14T03:15:41.975914Z",
  "layer_hint": "system"
}
